{
  "version": "1.0",
  "metadata": {
    "name": "Svelte Hello World",
    "description": "Create a simple Svelte hello world application",
    "author": "user",
    "created": "2025-01-14T00:00:00Z",
    "tags": ["svelte", "frontend", "hello-world"]
  },
  "goals": [
    {
      "id": "create-svelte-app",
      "objective": "Create a simple Svelte hello world application that displays a greeting message",
      "priority": 1,
      "criteria": {
        "success": [
          "Svelte project is initialized with proper structure",
          "App component displays 'Hello, World!' message",
          "Application runs successfully in development mode",
          "Page renders without errors in the browser"
        ],
        "acceptance": [
          "Running 'npm run dev' starts the development server",
          "Visiting the dev URL shows the hello world message"
        ],
        "validation": "manual"
      },
      "constraints": [
        "Use the official Svelte project template",
        "Keep the implementation minimal and simple",
        "No additional dependencies beyond the base template"
      ],
      "context": {
        "framework": "Svelte",
        "outputDir": "./svelte-hello-world"
      }
    }
  ],
  "globalContext": {
    "projectName": "svelte-hello-world",
    "targetEnvironment": "development"
  }
}
